{"appVersion":"0.5.1+6","checksum":{"algorithm":"SHA-256","value":"78ff49a4aff1d879fa806afda926054fff6bc40f52dd0bf62d651bdf9ecf693a"},"currency":"CNY","data":{"balanceRecords":[{"balanceMinor":0,"businessDate":"2026-10-21","businessTime":"08:00","createdAt":"2026-10-21T00:00:00.000Z","id":"d1d915dc-6521-4d51-a42f-6ca35c850d02","note":"","orderKey":0,"projectId":"c34814d1-17cf-4b40-a65f-21e80ca40371","updatedAt":"2026-10-21T00:00:00.000Z"}],"bills":[],"categories":[],"editHistory":[],"memos":[],"projectEntries":[],"projects":[{"categoryKey":"cash","colorKey":"neutral","createdAt":"2026-10-21T00:00:00.000Z","customName":null,"iconKey":"cash","id":"c34814d1-17cf-4b40-a65f-21e80ca40371","includeInSummary":true,"nameKey":"cash","note":"","sortOrder":0,"type":"asset","updatedAt":"2026-10-21T00:00:00.000Z"}],"settings":{"currency":"CNY","languageMode":"system","themeColor":"blue","themeMode":"system","timeZone":"Asia/Shanghai"}},"exportedAt":"2026-10-21T00:00:00.000Z","format":"finance-backup","schemaVersion":2,"timeZone":"Asia/Shanghai"}
